{
  "format_version": 2,
  "dictionary_id": 4,
  "code": "PJW",
  "region": "punjab",
  "crop": "wheat",
  "dictionary_version": 1,
  "languages": [
    "ur",
    "roman_ur"
  ],
  "entries": [
    {
      "id": 1,
      "code": "PJW-VAR-001",
      "category": "variety",
      "crop_stage": "sowing",
      "urgency": "advice",
      "text": {
        "ur": "پنجاب کے لیے زنگ (کنگی) برداشت کرنے والی منظور شدہ قسم کاشت کریں (مثلاً اکبر-2019، دلکش-2020)۔",
        "roman_ur": "Punjab ke liye zang (kangi) bardasht karnay wali manzoor-shuda qism kaasht karein (misaal: Akbar-2019, Dilkash-2020)."
      },
      "sources": [
        {
          "link": "https://pakera.pk/wheat-sowing-punjab-2026-seed-subsidy/",
          "note": "Punjab wheat sowing window/varieties 2026 — verify agripunjab.gov.pk"
        }
      ],
      "confidence": "medium",
      "status": "draft"
    },
    {
      "id": 2,
      "code": "PJW-VAR-002",
      "category": "variety",
      "crop_stage": "sowing",
      "urgency": "advice",
      "text": {
        "ur": "صرف ایک حساس قسم پر انحصار نہ کریں؛ تازہ منظور شدہ مزاحم قسم چنیں۔",
        "roman_ur": "Sirf aik hassaas qism par inhisaar na karein; taaza manzoor-shuda muzahim qism chunein."
      },
      "sources": [
        {
          "link": "https://www.frontiersin.org/journals/plant-science/articles/10.3389/fpls.2024.1494566/full",
          "note": "stripe-rust resistance in recent Pakistani cultivars"
        }
      ],
      "confidence": "medium",
      "status": "draft"
    },
    {
      "id": 3,
      "code": "PJW-SOW-001",
      "category": "sowing",
      "crop_stage": "sowing",
      "urgency": "advice",
      "text": {
        "ur": "کاشت سے پہلے کھیت اچھی طرح ہموار کریں اور گلی سڑی گوبر کی کھاد ڈالیں۔",
        "roman_ur": "Kaasht se pehlay khet achhi tarah hamwaar karein aur gali sari gobar ki khaad daalein."
      },
      "sources": [
        {
          "link": "http://www.parc.gov.pk/index.php/en/faq-s/60-faqs/270-faqs-wheat",
          "note": "PARC wheat FAQ"
        }
      ],
      "confidence": "high",
      "status": "draft"
    },
    {
      "id": 4,
      "code": "PJW-SOW-002",
      "category": "sowing",
      "crop_stage": "sowing",
      "urgency": "warning",
      "text": {
        "ur": "آبپاش زمین پر گندم یکم تا بیس نومبر کاشت کریں؛ یہی بہترین وقت ہے۔",
        "roman_ur": "Aabpaash zameen par gandum 1 ta 20 November kaasht karein; yehi behtareen waqt hai."
      },
      "sources": [
        {
          "link": "https://pakera.pk/wheat-sowing-punjab-2026-seed-subsidy/",
          "note": "Punjab wheat sowing window/varieties 2026 — verify agripunjab.gov.pk"
        }
      ],
      "confidence": "high",
      "status": "draft"
    },
    {
      "id": 5,
      "code": "PJW-SOW-003",
      "category": "sowing",
      "crop_stage": "sowing",
      "urgency": "advice",
      "text": {
        "ur": "بارانی زمین پر گندم پندرہ اکتوبر تا پندرہ نومبر کاشت کریں۔",
        "roman_ur": "Baarani zameen par gandum 15 October ta 15 November kaasht karein."
      },
      "sources": [
        {
          "link": "https://pakera.pk/wheat-sowing-punjab-2026-seed-subsidy/",
          "note": "Punjab wheat sowing window/varieties 2026 — verify agripunjab.gov.pk"
        }
      ],
      "confidence": "high",
      "status": "draft"
    },
    {
      "id": 6,
      "code": "PJW-SOW-004",
      "category": "sowing",
      "crop_stage": "sowing",
      "urgency": "warning",
      "text": {
        "ur": "بیس نومبر کے بعد ہر دن کی تاخیر پیداوار گھٹاتی ہے؛ جلد کاشت کریں۔",
        "roman_ur": "20 November ke baad har din ki taakheer paidawar ghataati hai; jald kaasht karein."
      },
      "sources": [
        {
          "link": "https://pakera.pk/wheat-sowing-punjab-2026-seed-subsidy/",
          "note": "Punjab wheat sowing window/varieties 2026 — verify agripunjab.gov.pk"
        }
      ],
      "confidence": "high",
      "status": "draft"
    },
    {
      "id": 7,
      "code": "PJW-SOW-005",
      "category": "sowing",
      "crop_stage": "sowing",
      "urgency": "advice",
      "text": {
        "ur": "چھٹے کے بجائے ڈرل سے کاشت کریں؛ فصل یکساں اور بیج کم لگتا ہے۔",
        "roman_ur": "Chhittay ke bajaye drill se kaasht karein; fasal yaksaan aur beej kam lagta hai."
      },
      "sources": [
        {
          "link": "https://pakera.pk/wheat-sowing-punjab-2026-seed-subsidy/",
          "note": "Punjab wheat sowing window/varieties 2026 — verify agripunjab.gov.pk"
        }
      ],
      "confidence": "high",
      "status": "draft"
    },
    {
      "id": 8,
      "code": "PJW-SOW-006",
      "category": "seed",
      "crop_stage": "sowing",
      "urgency": "advice",
      "text": {
        "ur": "آبپاش بروقت کاشت کے لیے تقریباً چالیس کلو بیج فی ایکڑ ڈالیں؛ دیر سے کاشت پر زیادہ۔",
        "roman_ur": "Aabpaash barwaqt kaasht ke liye taqreeban 40 kilo beej fi acre daalein; der se kaasht par zyada."
      },
      "sources": [
        {
          "link": "https://pakera.pk/wheat-sowing-punjab-2026-seed-subsidy/",
          "note": "Punjab wheat sowing window/varieties 2026 — verify agripunjab.gov.pk"
        }
      ],
      "confidence": "medium",
      "status": "draft"
    },
    {
      "id": 9,
      "code": "PJW-ROT-001",
      "category": "sowing",
      "crop_stage": "sowing",
      "urgency": "advice",
      "text": {
        "ur": "چاول یا باسمتی کے بعد گندم بروقت کاشت کریں اور دھان کی باقیات کا مناسب انتظام کریں۔",
        "roman_ur": "Chawal ya basmati ke baad gandum barwaqt kaasht karein aur dhaan ki baqiyaat ka munasib intizam karein."
      },
      "sources": [
        {
          "link": "[NEEDS SOURCE]",
          "note": "confirm with Punjab Agriculture Dept / AARI Faisalabad"
        }
      ],
      "confidence": "medium",
      "status": "draft"
    },
    {
      "id": 10,
      "code": "PJW-SED-001",
      "category": "seed",
      "crop_stage": "sowing",
      "urgency": "advice",
      "text": {
        "ur": "تصدیق شدہ قسم کا بیج استعمال کریں۔",
        "roman_ur": "Tasdeeq-shuda qism ka beej istemal karein."
      },
      "sources": [
        {
          "link": "https://pakera.pk/wheat-sowing-punjab-2026-seed-subsidy/",
          "note": "Punjab wheat sowing window/varieties 2026 — verify agripunjab.gov.pk"
        }
      ],
      "confidence": "medium",
      "status": "draft"
    },
    {
      "id": 11,
      "code": "PJW-SED-002",
      "category": "seed",
      "crop_stage": "sowing",
      "urgency": "advice",
      "text": {
        "ur": "بیج کا علاج کریں تاکہ کنڈوا اور دیمک سے بچاؤ ہو۔",
        "roman_ur": "Beej ka ilaaj karein taakay kandwa aur deemak se bachao ho."
      },
      "sources": [
        {
          "link": "https://pakera.pk/wheat-sowing-punjab-2026-seed-subsidy/",
          "note": "Punjab wheat sowing window/varieties 2026 — verify agripunjab.gov.pk"
        }
      ],
      "confidence": "medium",
      "status": "draft"
    },
    {
      "id": 12,
      "code": "PJW-FRT-001",
      "category": "fertilizer",
      "crop_stage": "sowing",
      "urgency": "advice",
      "text": {
        "ur": "کاشت کے وقت ڈی اے پی (فاسفورس) ڈالیں؛ اس سے جڑیں اور پھٹاؤ مضبوط ہوتے ہیں۔",
        "roman_ur": "Kaasht ke waqt DAP (phosphorus) daalein; is se jaren aur phutao mazboot hotay hain."
      },
      "sources": [
        {
          "link": "http://www.parc.gov.pk/index.php/en/faq-s/60-faqs/270-faqs-wheat",
          "note": "PARC wheat FAQ"
        }
      ],
      "confidence": "medium",
      "status": "draft"
    },
    {
      "id": 13,
      "code": "PJW-FRT-002",
      "category": "fertilizer",
      "crop_stage": "any",
      "urgency": "advice",
      "text": {
        "ur": "نائٹروجن ایک ساتھ نہیں، دو بار میں ڈالیں اور مٹی کے ٹیسٹ کے مطابق رکھیں۔",
        "roman_ur": "Nitrogen aik saath nahin, do baar mein daalein aur mitti ke test ke mutabiq rakhein."
      },
      "sources": [
        {
          "link": "http://www.parc.gov.pk/index.php/en/faq-s/60-faqs/270-faqs-wheat",
          "note": "PARC wheat FAQ"
        }
      ],
      "confidence": "medium",
      "status": "draft"
    },
    {
      "id": 14,
      "code": "PJW-FRT-003",
      "category": "fertilizer",
      "crop_stage": "any",
      "urgency": "advice",
      "text": {
        "ur": "نائٹروجن ضرورت سے زیادہ نہ ڈالیں؛ اس سے پیلا کنگی بڑھتا ہے۔",
        "roman_ur": "Nitrogen zaroorat se zyada na daalein; is se peela kangi barhta hai."
      },
      "sources": [
        {
          "link": "https://www.frontiersin.org/journals/plant-science/articles/10.3389/fpls.2024.1494566/full",
          "note": "stripe-rust resistance in recent Pakistani cultivars"
        }
      ],
      "confidence": "medium",
      "status": "draft"
    },
    {
      "id": 15,
      "code": "PJW-IRR-001",
      "category": "irrigation",
      "crop_stage": "vegetative",
      "urgency": "advice",
      "text": {
        "ur": "پہلا پانی کاشت کے بیس پچیس دن بعد (جڑ بننے پر) دیں۔",
        "roman_ur": "Pehla pani kaasht ke 20-25 din baad (jar bannay par) dein."
      },
      "sources": [
        {
          "link": "http://www.parc.gov.pk/index.php/en/faq-s/60-faqs/270-faqs-wheat",
          "note": "PARC wheat FAQ"
        }
      ],
      "confidence": "medium",
      "status": "draft"
    },
    {
      "id": 16,
      "code": "PJW-IRR-002",
      "category": "irrigation",
      "crop_stage": "any",
      "urgency": "advice",
      "text": {
        "ur": "پھٹاؤ، گابھے اور دانہ بننے کے وقت پانی کی کمی نہ ہونے دیں۔",
        "roman_ur": "Phutao, gaabhay aur dana bannay ke waqt pani ki kami na honay dein."
      },
      "sources": [
        {
          "link": "http://www.parc.gov.pk/index.php/en/faq-s/60-faqs/270-faqs-wheat",
          "note": "PARC wheat FAQ"
        }
      ],
      "confidence": "high",
      "status": "draft"
    },
    {
      "id": 17,
      "code": "PJW-IRR-003",
      "category": "irrigation",
      "crop_stage": "any",